{
  "authoring_attempt": 3,
  "binding_policy": "Bind concrete payload, source-tree delta, governance, and transition digests at deterministic bundle assembly.",
  "candidate_version": "v40.04r03",
  "classification": "release_infrastructure",
  "expected_test_count": 171,
  "frozen_claim": "Main, Manual I, Manual II, shared source, scientific ledgers, and external payloads are carried unchanged; only review-transition and surface-validation process tooling is revised. Target joins, SI/metric report activation, residuals, scores, empirical comparisons, subject/reference phase locks, native resonance periods, and hyperfine C6 pass/fail claims remain closed.",
  "implemented_changes": [
    "Made surface synchronization phase-aware so REVIEW/GO/FEEDBACK root workflow state is validated separately from preserved AUTHORING source templates.",
    "Aligned AUTHORING-to-REVIEW source-delta classification with the complete bundle validator for D.E.C. overlay and foundation doctrine paths.",
    "Added regression tests for phase-aware workflow surfaces and transition classifier parity.",
    "Preserved the accepted foundation doctrine, D.E.C. overlay rows, PDFs, and closed scientific lanes unchanged."
  ],
  "phase": "AUTHORING",
  "record_scope": "source_template",
  "report_id": "authoring_v40_04r03_review_transition_coherence_repair",
  "schema_version": "3.1",
  "unresolved_blockers": []
}
